{
  "$schema": "https://json-schema.org/draft/2020-12/schema",
  "$id": "https://webflix-lab.dev/contracts/generated-artifact.schema.json",
  "type": "object",
  "properties": {
    "recordType": {
      "type": "string",
      "const": "GeneratedArtifact"
    },
    "contractVersion": {
      "type": "string",
      "pattern": "^2\\.\\d+\\.\\d+$",
      "description": "Contract bundle version (major must match 2.x.x of the frozen contracts)."
    },
    "id": {
      "type": "string",
      "minLength": 1,
      "maxLength": 200,
      "pattern": "^[A-Za-z0-9][A-Za-z0-9._:-]*$",
      "description": "New id for every generation; never reuse or overwrite a golden reference."
    },
    "kind": {
      "type": "string",
      "enum": [
        "audio-overview",
        "video-overview"
      ]
    },
    "planId": {
      "type": "string",
      "minLength": 1,
      "maxLength": 200,
      "pattern": "^[A-Za-z0-9][A-Za-z0-9._:-]*$",
      "description": "OverviewPlan this artifact realizes."
    },
    "sourceIds": {
      "readOnly": true,
      "minItems": 1,
      "type": "array",
      "items": {
        "type": "string",
        "minLength": 1,
        "maxLength": 200,
        "pattern": "^[A-Za-z0-9][A-Za-z0-9._:-]*$",
        "description": "Stable identifier, e.g. \"claim-tool-catalog-1\"."
      }
    },
    "createdAt": {
      "type": "string",
      "pattern": "^\\d{4}-\\d{2}-\\d{2}T\\d{2}:\\d{2}:\\d{2}(\\.\\d+)?Z$",
      "description": "ISO-8601 UTC timestamp, e.g. \"2026-09-26T19:26:00Z\"."
    },
    "media": {
      "description": "Media fingerprint of a generated artifact.",
      "$ref": "#/$defs/MediaInfo"
    },
    "providers": {
      "readOnly": true,
      "description": "At least one provider stage must be recorded.",
      "minItems": 1,
      "type": "array",
      "items": {
        "description": "Which provider served which stage, with optional cost/latency.",
        "$ref": "#/$defs/ProviderUsage"
      }
    },
    "generator": {
      "description": "Generation provenance for the artifact.",
      "$ref": "#/$defs/ArtifactGeneratorInfo"
    },
    "qa": {
      "description": "QA summary identifying the smallest regenerable unit per issue.",
      "$ref": "#/$defs/QaSummary"
    },
    "derivedFromArtifactId": {
      "description": "Lineage: artifact this one regenerates or refines.",
      "type": "string",
      "minLength": 1,
      "maxLength": 200,
      "pattern": "^[A-Za-z0-9][A-Za-z0-9._:-]*$"
    },
    "notes": {
      "type": "string",
      "maxLength": 4000
    }
  },
  "required": [
    "recordType",
    "contractVersion",
    "id",
    "kind",
    "planId",
    "sourceIds",
    "createdAt",
    "media",
    "providers",
    "generator"
  ],
  "additionalProperties": false,
  "title": "GeneratedArtifact",
  "$defs": {
    "AudioMediaSpec": {
      "type": "object",
      "properties": {
        "codec": {
          "type": "string",
          "minLength": 1,
          "maxLength": 50
        },
        "channels": {
          "type": "integer",
          "minimum": 1,
          "maximum": 9007199254740991
        },
        "sampleRateHz": {
          "type": "integer",
          "minimum": 1,
          "maximum": 9007199254740991
        }
      },
      "required": [
        "codec",
        "channels",
        "sampleRateHz"
      ],
      "additionalProperties": false,
      "title": "AudioMediaSpec"
    },
    "VideoMediaSpec": {
      "type": "object",
      "properties": {
        "codec": {
          "type": "string",
          "minLength": 1,
          "maxLength": 50
        },
        "width": {
          "type": "integer",
          "minimum": 1,
          "maximum": 9007199254740991
        },
        "height": {
          "type": "integer",
          "minimum": 1,
          "maximum": 9007199254740991
        },
        "frameRate": {
          "type": "number",
          "exclusiveMinimum": 0
        }
      },
      "required": [
        "codec",
        "width",
        "height",
        "frameRate"
      ],
      "additionalProperties": false,
      "title": "VideoMediaSpec"
    },
    "MediaInfo": {
      "type": "object",
      "properties": {
        "container": {
          "type": "string",
          "enum": [
            "mp4",
            "webm",
            "m4a",
            "mp3",
            "wav",
            "ogg"
          ],
          "description": "Media container format."
        },
        "sha256": {
          "type": "string",
          "pattern": "^[0-9a-f]{64}$",
          "description": "SHA-256 of the media file bytes."
        },
        "sizeBytes": {
          "type": "integer",
          "minimum": 0,
          "maximum": 9007199254740991,
          "description": "File size in bytes."
        },
        "durationSeconds": {
          "type": "number",
          "exclusiveMinimum": 0,
          "description": "Measured duration in seconds."
        },
        "audio": {
          "description": "Audio stream specification.",
          "$ref": "#/$defs/AudioMediaSpec"
        },
        "video": {
          "description": "Video stream specification.",
          "$ref": "#/$defs/VideoMediaSpec"
        }
      },
      "required": [
        "container",
        "sha256",
        "sizeBytes",
        "durationSeconds"
      ],
      "additionalProperties": false,
      "title": "MediaInfo"
    },
    "ProviderUsage": {
      "type": "object",
      "properties": {
        "stage": {
          "type": "string",
          "enum": [
            "script",
            "speech",
            "image",
            "video",
            "composition",
            "evaluation"
          ],
          "description": "Compiler stage a provider served."
        },
        "provider": {
          "type": "string",
          "minLength": 1,
          "maxLength": 200,
          "description": "Provider-neutral identity, e.g. \"gemini-tts\", \"deterministic-svg\"."
        },
        "model": {
          "type": "string",
          "minLength": 1,
          "maxLength": 200
        },
        "latencyMs": {
          "type": "integer",
          "minimum": 0,
          "maximum": 9007199254740991
        },
        "costUsd": {
          "type": "number",
          "minimum": 0
        }
      },
      "required": [
        "stage",
        "provider"
      ],
      "additionalProperties": false,
      "title": "ProviderUsage"
    },
    "ArtifactGeneratorInfo": {
      "type": "object",
      "properties": {
        "name": {
          "type": "string",
          "minLength": 1,
          "maxLength": 200
        },
        "version": {
          "type": "string",
          "pattern": "^\\d+\\.\\d+\\.\\d+$",
          "description": "Semantic version, e.g. \"0.1.0\"."
        },
        "seed": {
          "type": "string",
          "minLength": 1,
          "maxLength": 200
        },
        "reproducible": {
          "type": "boolean"
        }
      },
      "required": [
        "name",
        "version",
        "reproducible"
      ],
      "additionalProperties": false,
      "title": "ArtifactGeneratorInfo"
    },
    "QaIssue": {
      "type": "object",
      "properties": {
        "severity": {
          "type": "string",
          "enum": [
            "info",
            "warning",
            "error",
            "blocker"
          ],
          "description": "QA issue severity."
        },
        "code": {
          "type": "string",
          "minLength": 1,
          "maxLength": 100,
          "description": "Stable issue code, e.g. \"label-mismatch\"."
        },
        "message": {
          "type": "string",
          "minLength": 1,
          "maxLength": 2000
        },
        "unitId": {
          "description": "Smallest regenerable unit the issue belongs to.",
          "type": "string",
          "minLength": 1,
          "maxLength": 200,
          "pattern": "^[A-Za-z0-9][A-Za-z0-9._:-]*$"
        }
      },
      "required": [
        "severity",
        "code",
        "message"
      ],
      "additionalProperties": false,
      "title": "QaIssue"
    },
    "QaSummary": {
      "type": "object",
      "properties": {
        "status": {
          "type": "string",
          "enum": [
            "passed",
            "passed-with-issues",
            "failed",
            "not-evaluated"
          ]
        },
        "issues": {
          "readOnly": true,
          "type": "array",
          "items": {
            "description": "One typed QA issue.",
            "$ref": "#/$defs/QaIssue"
          }
        }
      },
      "required": [
        "status",
        "issues"
      ],
      "additionalProperties": false,
      "title": "QaSummary"
    }
  }
}
