{"contractVersion":"2.0.0","createdAt":"2026-01-01T00:00:00Z","generator":{"name":"AudioOverviewCompiler@0.1.0","reproducible":true,"seed":"wflx-interactive-audio-seed","version":"0.1.0"},"id":"artifact-interactive-audio-session-01","kind":"audio-overview","media":{"audio":{"channels":1,"codec":"pcm_s16le","sampleRateHz":44100},"container":"wav","durationSeconds":327.839,"sha256":"0cd086c78e219a8512f153e6a054a57239f52a4a9992ec1b76ce23cefe44d22f","sizeBytes":28915440},"notes":"EV-018 interactive audio session: baseline overview + listener intervention (text-scripted stand-in; voice capture UNRESOLVED) + source-grounded response compiled through the same machinery; original turns byte-identical across the boundary (locality proof in session summary); response segment QA carried here (the baseline QA lives on the baseline artifact). Deterministic at fixed (seed, now, intervention) for the offline provider.","planId":"plan-messy-note-audio-deep-dive-5min","providers":[{"model":"0.1.0","provider":"wflx-dialogue-realizer","stage":"script"},{"costUsd":0,"provider":"deterministic-offline-tts","stage":"speech"},{"model":"0.1.0","provider":"wflx-master-pure-ts","stage":"composition"},{"model":"0.1.0","provider":"wflx-audio-qa","stage":"evaluation"}],"qa":{"issues":[{"code":"pronunciation-risk","message":"2 risky token(s) flagged across 1 turns: AI (acronym), scraping/API (symbols)","severity":"info"}],"status":"passed"},"recordType":"GeneratedArtifact","sourceIds":["source-messy-note-redacted"]}
