{"contractVersion":"2.0.0","createdAt":"2026-01-01T00:00:00Z","generator":{"name":"AudioOverviewCompiler@0.1.0","reproducible":true,"seed":"wflx-exp-l02-audio-seed","version":"0.1.0"},"id":"artifact-exp-l02-debate-5min","kind":"audio-overview","media":{"audio":{"channels":1,"codec":"pcm_s16le","sampleRateHz":44100},"container":"wav","durationSeconds":305.341,"sha256":"e7bf0adaa26d7436ef5f8b2c9e7d4be0ce681b02ca3860e8ad1137116616a9a9","sizeBytes":26931122},"notes":"Offline lab reconstruction; deterministic-offline-tts speech is placeholder audio, NOT product parity evidence (AGENTS.md). Regenerate byte-identically with seed 'wflx-exp-l02-audio-seed' and the same inputs. Mastering: wflx-master-pure-ts@0.1.0 (BS.1770-4 integrated loudness, sample-peak ceiling).","planId":"plan-messy-note-audio-debate-5min","providers":[{"model":"0.1.0","provider":"wflx-dialogue-realizer","stage":"script"},{"costUsd":0,"provider":"deterministic-offline-tts","stage":"speech"},{"model":"0.1.0","provider":"wflx-master-pure-ts","stage":"composition"},{"model":"0.1.0","provider":"wflx-audio-qa","stage":"evaluation"}],"qa":{"issues":[{"code":"no-interjection-turns","message":"plan carries no interjection/backchannel turns; conversational tissue is realized inside turn text (DESIGN.md §16.4 item 3 — awaiting Director ruling)","severity":"info"},{"code":"pronunciation-risk","message":"24 risky token(s) flagged across 9 turns: AI (acronym), scraping/API (symbols), digital-twin/world-monitoring (symbols), Cloudflare/object (symbols), Postgres/Neon (symbols), LLM (acronym), Vercel/GitHub (symbols), Redis (proper-noun)","severity":"info"},{"code":"mode-semantics-missing","message":"debate plan of 19 turns carries no 'position_statement' turns — plan structure may violate mode semantics (Director feedback; structure is plan-authoritative)","severity":"warning"},{"code":"mode-semantics-missing","message":"debate plan of 19 turns carries no 'rebuttal' turns — plan structure may violate mode semantics (Director feedback; structure is plan-authoritative)","severity":"warning"},{"code":"mode-semantics-missing","message":"debate plan of 19 turns carries no 'cross_examination' turns — plan structure may violate mode semantics (Director feedback; structure is plan-authoritative)","severity":"warning"}],"status":"passed-with-issues"},"recordType":"GeneratedArtifact","sourceIds":["source-messy-note-redacted"]}
