{"contractVersion":"1.0.0","createdAt":"2026-09-27T00:00:00Z","generator":{"name":"AudioOverviewCompiler@0.1.0","reproducible":true,"seed":"wflx-exp-a-audio-seed","version":"0.1.0"},"id":"artifact-exp-a04-mut-b30-deepdive-5min","kind":"audio-overview","media":{"audio":{"channels":1,"codec":"pcm_s16le","sampleRateHz":44100},"container":"wav","durationSeconds":307.638,"sha256":"c3cfa23dbd326c29b058d0e00a5a177a325e227d752609e5877ff8177f2a66a9","sizeBytes":27133716},"notes":"EXP-A series run a04-mut-b30-deepdive-5min (exp-a-04-mutation); deterministic; tl2 integration station 2026-09-27","planId":"plan-exp-a04-audio-deepdive-5min","providers":[{"model":"0.1.0","provider":"wflx-dialogue-realizer","stage":"script"},{"costUsd":0,"provider":"deterministic-offline-tts","stage":"speech"},{"model":"0.1.0","provider":"wflx-master-pure-ts","stage":"composition"},{"model":"0.1.0","provider":"wflx-audio-qa","stage":"evaluation"}],"qa":{"issues":[{"code":"alternation-run-long","message":"longest strict alternation run is 25/25 turns (100% of the graph) — near-parity walk (H-A-04; plan turn structure is authoritative, this feeds back to the Director)","severity":"warning"},{"code":"no-interjection-turns","message":"plan carries no interjection/backchannel turns; conversational tissue is realized inside turn text (DESIGN.md §16.4 item 3 — awaiting Director ruling)","severity":"info"},{"code":"pronunciation-risk","message":"17 risky token(s) flagged across 13 turns: Test (proper-noun), Video (proper-noun), Overview (proper-noun), credential/API-key (symbols), AI (acronym), REDACTED (acronym), Infrastructure (proper-noun), Cloudflare (proper-noun)","severity":"info"},{"code":"mode-semantics-missing","message":"deep-dive plan of 25 turns carries no 'connection' turns — plan structure may violate mode semantics (Director feedback; structure is plan-authoritative)","severity":"warning"},{"code":"turn-over-budget","message":"turn turn-21: mandatory anchors cannot fit 14 words at the mode rate ceiling (25 words needed) — over-budget per §16.2 item 3, coverage is Director authority","severity":"error","unitId":"turn-21"}],"status":"failed"},"recordType":"GeneratedArtifact","sourceIds":["source-messy-note-redacted"]}
