{"contractVersion":"2.0.0","createdAt":"2026-09-30T00:00:00Z","generator":{"name":"AudioOverviewCompiler@0.1.0","reproducible":true,"seed":"wflx-exp-x02-audio-seed","version":"0.1.0"},"id":"artifact-exp-x02-b-baseline-defect-deepdive-5min","kind":"audio-overview","media":{"audio":{"channels":1,"codec":"pcm_s16le","sampleRateHz":44100},"container":"wav","durationSeconds":306.623,"sha256":"63f94c87b23db18d7173e4f61641bdc57a01fba1925fa51ece2172718ce616a4","sizeBytes":27044192},"notes":"Offline lab reconstruction; deterministic-offline-tts speech is placeholder audio, NOT product parity evidence (AGENTS.md). Regenerate byte-identically with seed 'wflx-exp-x02-audio-seed' and the same inputs. Mastering: wflx-master-pure-ts@0.1.0 (BS.1770-4 integrated loudness, sample-peak ceiling).","planId":"plan-messy-note-audio-deep-dive-5min","providers":[{"model":"0.1.0","provider":"wflx-dialogue-realizer","stage":"script"},{"costUsd":0,"provider":"deterministic-offline-tts","stage":"speech"},{"model":"0.1.0","provider":"wflx-master-pure-ts","stage":"composition"},{"model":"0.1.0","provider":"wflx-audio-qa","stage":"evaluation"}],"qa":{"issues":[{"code":"alternation-run-long","message":"longest strict alternation run is 19/22 turns (86% of the graph) — near-parity walk (H-A-04; plan turn structure is authoritative, this feeds back to the Director)","severity":"warning"},{"code":"no-interjection-turns","message":"plan carries no interjection/backchannel turns; conversational tissue is realized inside turn text (DESIGN.md §16.4 item 3 — awaiting Director ruling)","severity":"info"},{"code":"pronunciation-risk","message":"26 risky token(s) flagged across 11 turns: digital-twin/world-monitoring (symbols), AI (acronym), scraping/API (symbols), Cloudflare/object (symbols), Postgres/Neon (symbols), LLM (acronym), Vercel/GitHub (symbols), Redis (proper-noun)","severity":"info"},{"code":"turn-over-budget","message":"turn turn-3: mandatory anchors cannot fit 29 words at the mode rate ceiling (54 words needed) — over-budget per §16.2 item 3, coverage is Director authority","severity":"error","unitId":"turn-3"}],"status":"failed"},"recordType":"GeneratedArtifact","sourceIds":["source-messy-note-redacted"]}
