{"contractVersion":"1.0.0","createdAt":"2026-09-30T00:00:00Z","generator":{"name":"AudioOverviewCompiler@0.1.0","reproducible":true,"seed":"wflx-exp-a-audio-seed","version":"0.1.0"},"id":"artifact-exp-a-r2-deepdive-5min-baseline","kind":"audio-overview","media":{"audio":{"channels":1,"codec":"pcm_s16le","sampleRateHz":44100},"container":"wav","durationSeconds":306.819,"sha256":"56e69b05f8b5141aa122729007ec2059ffcab1785134daaa093124dface5328d","sizeBytes":27061478},"notes":"WFLX-P3B wave-2 integration experiment arm deepdive-5min-baseline (exp-a-01/02/03-baseline); deterministic; fixed now 2026-09-30T00:00:00Z","planId":"plan-exp-a-r2-audio-deepdive-5min","providers":[{"model":"0.1.0","provider":"wflx-dialogue-realizer","stage":"script"},{"costUsd":0,"provider":"deterministic-offline-tts","stage":"speech"},{"model":"0.1.0","provider":"wflx-master-pure-ts","stage":"composition"},{"model":"0.1.0","provider":"wflx-audio-qa","stage":"evaluation"}],"qa":{"issues":[{"code":"alternation-run-long","message":"longest strict alternation run is 17/20 turns (85% of the graph) — near-parity walk (H-A-04; plan turn structure is authoritative, this feeds back to the Director)","severity":"warning"},{"code":"no-interjection-turns","message":"plan carries no interjection/backchannel turns; conversational tissue is realized inside turn text (DESIGN.md §16.4 item 3 — awaiting Director ruling)","severity":"info"},{"code":"pronunciation-risk","message":"27 risky token(s) flagged across 11 turns: AI (acronym), scraping/API (symbols), digital-twin/world-monitoring (symbols), Cloudflare/object (symbols), Postgres/Neon (symbols), LLM (acronym), Vercel/GitHub (symbols), Redis (proper-noun)","severity":"info"},{"code":"mode-semantics-missing","message":"deep-dive plan of 20 turns carries no 'connection' turns — plan structure may violate mode semantics (Director feedback; structure is plan-authoritative)","severity":"warning"}],"status":"passed-with-issues"},"recordType":"GeneratedArtifact","sourceIds":["source-messy-note-redacted"]}
