{"contractVersion":"2.0.0","createdAt":"2026-09-27T00:00:00Z","generator":{"name":"AudioOverviewCompiler@0.1.0","reproducible":true,"seed":"wflx-exp-a-audio-seed","version":"0.1.0"},"id":"artifact-exp-a-critique-5min","kind":"audio-overview","media":{"audio":{"channels":1,"codec":"pcm_s16le","sampleRateHz":44100},"container":"wav","durationSeconds":305.278,"sha256":"79220d991b2e58271bc81bb072a094f9d2704319f5d7d2a31a1024714c7db188","sizeBytes":26925562},"notes":"EXP-A series run critique-5min-canonical (exp-a-02); deterministic; tl2 integration station 2026-09-27","planId":"plan-messy-note-audio-critique-5min","providers":[{"model":"0.1.0","provider":"wflx-dialogue-realizer","stage":"script"},{"costUsd":0,"provider":"deterministic-offline-tts","stage":"speech"},{"model":"0.1.0","provider":"wflx-master-pure-ts","stage":"composition"},{"model":"0.1.0","provider":"wflx-audio-qa","stage":"evaluation"}],"qa":{"issues":[{"code":"alternation-run-long","message":"longest strict alternation run is 17/19 turns (89% of the graph) — near-parity walk (H-A-04; plan turn structure is authoritative, this feeds back to the Director)","severity":"warning"},{"code":"no-interjection-turns","message":"plan carries no interjection/backchannel turns; conversational tissue is realized inside turn text (DESIGN.md §16.4 item 3 — awaiting Director ruling)","severity":"info"},{"code":"pronunciation-risk","message":"25 risky token(s) flagged across 9 turns: AI (acronym), scraping/API (symbols), digital-twin/world-monitoring (symbols), Cloudflare/object (symbols), Postgres/Neon (symbols), LLM (acronym), Vercel/GitHub (symbols), Redis (proper-noun)","severity":"info"},{"code":"mode-semantics-missing","message":"critique plan of 19 turns carries no 'assessment' turns — plan structure may violate mode semantics (Director feedback; structure is plan-authoritative)","severity":"warning"},{"code":"mode-semantics-missing","message":"critique plan of 19 turns carries no 'limitation' turns — plan structure may violate mode semantics (Director feedback; structure is plan-authoritative)","severity":"warning"},{"code":"mode-semantics-missing","message":"critique plan of 19 turns carries no 'verdict' turns — plan structure may violate mode semantics (Director feedback; structure is plan-authoritative)","severity":"warning"}],"status":"passed-with-issues"},"recordType":"GeneratedArtifact","sourceIds":["source-messy-note-redacted"]}
