{"contractVersion":"2.0.0","createdAt":"2026-01-01T00:00:00Z","generator":{"name":"AudioOverviewCompiler@0.1.0","reproducible":true,"seed":"wflx-exp-l02-audio-seed","version":"0.1.0"},"id":"artifact-exp-l02-brief-2min","kind":"audio-overview","media":{"audio":{"channels":1,"codec":"pcm_s16le","sampleRateHz":44100},"container":"wav","durationSeconds":121.665,"sha256":"c72826366d1e8331f32faa290edfc49a0e597d3b95050e72b6f484712eaf8fc8","sizeBytes":10730898},"notes":"Offline lab reconstruction; deterministic-offline-tts speech is placeholder audio, NOT product parity evidence (AGENTS.md). Regenerate byte-identically with seed 'wflx-exp-l02-audio-seed' and the same inputs. Mastering: wflx-master-pure-ts@0.1.0 (BS.1770-4 integrated loudness, sample-peak ceiling).","planId":"plan-messy-note-audio-brief-2min","providers":[{"model":"0.1.0","provider":"wflx-dialogue-realizer","stage":"script"},{"costUsd":0,"provider":"deterministic-offline-tts","stage":"speech"},{"model":"0.1.0","provider":"wflx-master-pure-ts","stage":"composition"},{"model":"0.1.0","provider":"wflx-audio-qa","stage":"evaluation"}],"qa":{"issues":[{"code":"pronunciation-risk","message":"8 risky token(s) flagged across 3 turns: AI (acronym), scraping/API (symbols), Cloudflare/object (symbols), Postgres/Neon (symbols), LLM (acronym), Vercel/GitHub (symbols), Redis (proper-noun), Test (proper-noun)","severity":"info"}],"status":"passed"},"recordType":"GeneratedArtifact","sourceIds":["source-messy-note-redacted"]}
