{"contractVersion":"2.0.0","createdAt":"2026-09-30T00:00:00Z","generator":{"name":"AudioOverviewCompiler@0.1.0","reproducible":true,"seed":"wflx-exp-a-audio-seed","version":"0.1.0"},"id":"artifact-exp-a-r2-a04-mut-b30-deepdive-5min","kind":"audio-overview","media":{"audio":{"channels":1,"codec":"pcm_s16le","sampleRateHz":44100},"container":"wav","durationSeconds":307.296,"sha256":"712d07300d22e9760a078bfd787bc7387c50908df3cfa7d7444bbc39ef3fc030","sizeBytes":27103550},"notes":"WFLX-P3B wave-2 integration experiment arm a04-mut-b30-deepdive-5min (exp-a-04-mutation); deterministic; fixed now 2026-09-30T00:00:00Z","planId":"plan-exp-a-r2-audio-deepdive-5min","providers":[{"model":"0.1.0","provider":"wflx-dialogue-realizer","stage":"script"},{"costUsd":0,"provider":"deterministic-offline-tts","stage":"speech"},{"model":"0.1.0","provider":"wflx-master-pure-ts","stage":"composition"},{"model":"0.1.0","provider":"wflx-audio-qa","stage":"evaluation"}],"qa":{"issues":[{"code":"alternation-run-long","message":"longest strict alternation run is 21/24 turns (88% of the graph) — near-parity walk (H-A-04; plan turn structure is authoritative, this feeds back to the Director)","severity":"warning"},{"code":"no-interjection-turns","message":"plan carries no interjection/backchannel turns; conversational tissue is realized inside turn text (DESIGN.md §16.4 item 3 — awaiting Director ruling)","severity":"info"},{"code":"pronunciation-risk","message":"17 risky token(s) flagged across 13 turns: Test (proper-noun), Video (proper-noun), Overview (proper-noun), Credential/API-key (symbols), AI (acronym), REDACTED (acronym), Infrastructure (proper-noun), Cloudflare (proper-noun)","severity":"info"},{"code":"mode-semantics-missing","message":"deep-dive plan of 24 turns carries no 'connection' turns — plan structure may violate mode semantics (Director feedback; structure is plan-authoritative)","severity":"warning"}],"status":"passed-with-issues"},"recordType":"GeneratedArtifact","sourceIds":["source-messy-note-redacted"]}
