{"contractVersion":"2.0.0","createdAt":"2026-09-30T00:00:00Z","generator":{"name":"AudioOverviewCompiler@0.1.0","reproducible":true,"seed":"wflx-exp-a-audio-seed","version":"0.1.0"},"id":"artifact-exp-a-r2-brief-5min-deconfound","kind":"audio-overview","media":{"audio":{"channels":1,"codec":"pcm_s16le","sampleRateHz":44100},"container":"wav","durationSeconds":301.854,"sha256":"1ecc86ada1c4d566c5cc0357368b341fde45c3fc464241c6307f9f9d21cd2d5a","sizeBytes":26623566},"notes":"WFLX-P3B wave-2 integration experiment arm brief-5min-deconfound (exp-a-01-deconfound); deterministic; fixed now 2026-09-30T00:00:00Z","planId":"plan-exp-a-r2-audio-brief-5min","providers":[{"model":"0.1.0","provider":"wflx-dialogue-realizer","stage":"script"},{"costUsd":0,"provider":"deterministic-offline-tts","stage":"speech"},{"model":"0.1.0","provider":"wflx-master-pure-ts","stage":"composition"},{"model":"0.1.0","provider":"wflx-audio-qa","stage":"evaluation"}],"qa":{"issues":[{"code":"no-question-answer-pair","message":"no question->answer (respondsTo) links in the graph (H-A-04)","severity":"warning"},{"code":"no-interjection-turns","message":"plan carries no interjection/backchannel turns; conversational tissue is realized inside turn text (DESIGN.md §16.4 item 3 — awaiting Director ruling)","severity":"info"},{"code":"pronunciation-risk","message":"21 risky token(s) flagged across 8 turns: Test (proper-noun), AI (acronym), scraping/API (symbols), digital-twin/world-monitoring (symbols), Cloudflare/object (symbols), Postgres/Neon (symbols), LLM (acronym), Vercel/GitHub (symbols)","severity":"info"}],"status":"passed-with-issues"},"recordType":"GeneratedArtifact","sourceIds":["source-messy-note-redacted"]}
