{"contractVersion":"2.0.0","createdAt":"2026-01-01T00:00:00Z","generator":{"name":"AudioOverviewCompiler@0.1.0","reproducible":false,"seed":"wflx-w2-audio-test-seed","version":"0.1.0"},"id":"audio-overview-d512dfc74997","kind":"audio-overview","media":{"audio":{"channels":1,"codec":"pcm_s16le","sampleRateHz":44100},"container":"wav","durationSeconds":61.755,"sha256":"ebec31bbf28ad753bde8cf356647dc793ae123651155ea3f48f68c4b80ffa082","sizeBytes":5446910},"notes":"EXP-L-01 LIVE run (EV-016): real speech synthesized by the z-ai-web-dev-sdk server-side TTS service through the SpeechProvider port (adapter zai-live-tts). Honestly stochastic per call (LAB-06 discipline) — byte-identity NOT claimed for this artifact. Env activation flag: WFLX_TTS_PROVIDER=live-zai. Offline deterministic path remains the DEFAULT and is byte-unchanged (F4). Live speech, not product-parity evidence (AGENTS.md).","planId":"plan-messy-note-audio-deep-dive-42s-benchmark","providers":[{"model":"0.1.0","provider":"wflx-dialogue-realizer","stage":"script"},{"model":"zai-tts-1","provider":"zai-live-tts","stage":"speech"},{"model":"0.1.0","provider":"wflx-master-pure-ts","stage":"composition"},{"model":"0.1.0","provider":"wflx-audio-qa","stage":"evaluation"}],"qa":{"issues":[{"code":"duration-off-target","message":"total duration 61.76 s is outside ±10.0 s of plan target 42 s (turns sum to 60.10 s; gap policy adds 1.66 s)","severity":"warning"},{"code":"turn-duration-drift","message":"turn s-turn-1: synthesized 16.10 s vs target 8.00 s (101.3% drift)","severity":"warning","unitId":"s-turn-1"},{"code":"turn-duration-drift","message":"turn s-turn-2: synthesized 17.09 s vs target 10.00 s (70.9% drift)","severity":"warning","unitId":"s-turn-2"},{"code":"turn-duration-drift","message":"turn s-turn-3: synthesized 6.22 s vs target 8.00 s (22.3% drift)","severity":"warning","unitId":"s-turn-3"},{"code":"turn-duration-drift","message":"turn s-turn-4: synthesized 9.23 s vs target 8.00 s (15.4% drift)","severity":"warning","unitId":"s-turn-4"},{"code":"turn-duration-drift","message":"turn s-turn-5: synthesized 11.46 s vs target 8.00 s (43.3% drift)","severity":"warning","unitId":"s-turn-5"},{"code":"pronunciation-risk","message":"2 risky token(s) flagged across 1 turns: AI (acronym), scraping/API (symbols)","severity":"info"},{"code":"loudness-limited","message":"target gain limited by the -1.5 dB peak ceiling (applied 1.51 dB)","severity":"warning"}],"status":"passed-with-issues"},"recordType":"GeneratedArtifact","sourceIds":["source-messy-note-redacted"]}
