{"contractVersion":"1.0.0","createdAt":"2026-01-01T00:00:00Z","generator":{"name":"AudioOverviewCompiler@0.1.0","reproducible":true,"seed":"wflx-w2-audio-test-seed","version":"0.1.0"},"id":"audio-overview-945d889dbdf6","kind":"audio-overview","media":{"audio":{"channels":1,"codec":"pcm_s16le","sampleRateHz":44100},"container":"wav","durationSeconds":43.667,"sha256":"39c60b46cb614caeee71587698899c505eca8148c73e30fea53203d4cbe35db3","sizeBytes":3851472},"notes":"Offline lab reconstruction; deterministic-offline-tts speech is placeholder audio, NOT product parity evidence (AGENTS.md). Regenerate byte-identically with seed 'wflx-w2-audio-test-seed' and the same inputs. Mastering: wflx-master-pure-ts@0.1.0 (BS.1770-4 integrated loudness, sample-peak ceiling).","planId":"plan-messy-note-audio-deep-dive-42s-benchmark","providers":[{"model":"0.1.0","provider":"wflx-dialogue-realizer","stage":"script"},{"costUsd":0,"provider":"deterministic-offline-tts","stage":"speech"},{"model":"0.1.0","provider":"wflx-master-pure-ts","stage":"composition"},{"model":"0.1.0","provider":"wflx-audio-qa","stage":"evaluation"}],"qa":{"issues":[{"code":"pronunciation-risk","message":"2 risky token(s) flagged across 1 turns: AI (acronym), scraping/API (symbols)","severity":"info"}],"status":"passed"},"recordType":"GeneratedArtifact","sourceIds":["source-messy-note-redacted"]}
