{"contractVersion":"1.0.0","createdAt":"2026-09-27T00:00:00Z","generator":{"name":"AudioOverviewCompiler@0.1.0","reproducible":true,"seed":"wflx-exp-a-audio-seed","version":"0.1.0"},"id":"artifact-exp-a-debate-5min","kind":"audio-overview","media":{"audio":{"channels":1,"codec":"pcm_s16le","sampleRateHz":44100},"container":"wav","durationSeconds":305.521,"sha256":"ed4de0c42623a1bb6bb6537e154e682e5c4a94d6f4c66f937f5d23613ef3f68e","sizeBytes":26947000},"notes":"EXP-A series run debate-5min-canonical (exp-a-03); deterministic; tl2 integration station 2026-09-27","planId":"plan-messy-note-audio-debate-5min","providers":[{"model":"0.1.0","provider":"wflx-dialogue-realizer","stage":"script"},{"costUsd":0,"provider":"deterministic-offline-tts","stage":"speech"},{"model":"0.1.0","provider":"wflx-master-pure-ts","stage":"composition"},{"model":"0.1.0","provider":"wflx-audio-qa","stage":"evaluation"}],"qa":{"issues":[{"code":"no-interjection-turns","message":"plan carries no interjection/backchannel turns; conversational tissue is realized inside turn text (DESIGN.md §16.4 item 3 — awaiting Director ruling)","severity":"info"},{"code":"pronunciation-risk","message":"27 risky token(s) flagged across 10 turns: AI (acronym), scraping/API (symbols), digital-twin/world-monitoring (symbols), Cloudflare/object (symbols), Postgres/Neon (symbols), LLM (acronym), Vercel/GitHub (symbols), Redis (proper-noun)","severity":"info"},{"code":"mode-semantics-missing","message":"debate plan of 19 turns carries no 'position_statement' turns — plan structure may violate mode semantics (Director feedback; structure is plan-authoritative)","severity":"warning"},{"code":"mode-semantics-missing","message":"debate plan of 19 turns carries no 'rebuttal' turns — plan structure may violate mode semantics (Director feedback; structure is plan-authoritative)","severity":"warning"},{"code":"mode-semantics-missing","message":"debate plan of 19 turns carries no 'cross_examination' turns — plan structure may violate mode semantics (Director feedback; structure is plan-authoritative)","severity":"warning"}],"status":"passed-with-issues"},"recordType":"GeneratedArtifact","sourceIds":["source-messy-note-redacted"]}
